[
  {
    "schemaVersion": "1.0.0",
    "blueprintId": "template:product-hero",
    "revision": 1,
    "entryPoint": {
      "kind": "template",
      "id": "product-hero",
      "version": "1.0.0"
    },
    "catalog": {
      "templateId": "product-hero",
      "templateVersion": "1.0.0",
      "catalogVersion": "1.0.0"
    },
    "creative": {
      "objective": "product_promotion",
      "audience": "User must provide target audience",
      "productOrService": "User must select product or service",
      "coreMessage": "User must provide creative message"
    },
    "references": [
      {
        "id": "w0a-product-hero",
        "availability": "w7Only",
        "approval": "approvedVisualBaseline",
        "locator": ".tmp/consolidated-release/w0a-visual/assets/w0a-product-hero.jpg",
        "sha256": "14d12cf8e1b29563da5eabe16481c2d460f0dd442b9d9b562955bf72bbf48dd1",
        "approvalEvidence": ".tmp/consolidated-release/w0a-visual/W0A-VISUAL-DESIGN-PACKAGE.md",
        "provenance": ".tmp/consolidated-release/w0a-visual/SAMPLE-ASSET-PROVENANCE.md",
        "allowedUses": [
          "internalDesignReview"
        ]
      }
    ],
    "requirements": [
      {
        "slotId": "product",
        "role": "product_image",
        "minCount": 1,
        "maxCount": 1,
        "distinctBy": "assetId",
        "acceptedMime": [
          "image/png",
          "image/jpeg",
          "image/webp"
        ],
        "minimumWidth": 512,
        "minimumHeight": 512
      },
      {
        "slotId": "logo",
        "role": "logo_primary",
        "minCount": 1,
        "maxCount": 1,
        "distinctBy": "assetId",
        "acceptedMime": [
          "image/png",
          "image/jpeg",
          "image/webp"
        ],
        "minimumWidth": 128,
        "minimumHeight": 64
      }
    ],
    "artDirection": {
      "expectedComposition": "Single real SKU dominates mid-frame; calm luxury studio surface, coherent contact shadow and clear headline/CTA hierarchy.",
      "background": "brandGradient",
      "lighting": "Coherent soft key light, material-appropriate reflection and grounded contact shadows; reference-led direction needs review.",
      "mood": "Adapt approved reference to user brand; do not reuse demo brand identity.",
      "camera": "Use supplied subject view; novel product perspective or model pose is unsupported.",
      "avoid": [
        "generated labels or logos",
        "invented product shades",
        "AI-baked headlines",
        "unverified offer facts"
      ]
    },
    "composition": {
      "regions": [
        {
          "id": "bg",
          "x": 0,
          "y": 0,
          "width": 1,
          "height": 1
        },
        {
          "id": "product",
          "x": 0.15,
          "y": 0.18,
          "width": 0.7,
          "height": 0.48
        },
        {
          "id": "headline",
          "x": 0.08,
          "y": 0.68,
          "width": 0.84,
          "height": 0.12
        },
        {
          "id": "supporting",
          "x": 0.08,
          "y": 0.8,
          "width": 0.84,
          "height": 0.08
        },
        {
          "id": "cta",
          "x": 0.3,
          "y": 0.9,
          "width": 0.4,
          "height": 0.06
        },
        {
          "id": "logo",
          "x": 0.78,
          "y": 0.04,
          "width": 0.16,
          "height": 0.08
        }
      ],
      "safeArea": {
        "id": "safe",
        "x": 0.04,
        "y": 0.04,
        "width": 0.92,
        "height": 0.92
      },
      "focalPoint": {
        "x": 0.5,
        "y": 0.42
      },
      "visualReferenceDifference": "W0A artwork has headline above product; committed catalog has headline below. Keep baseline geometry until owner resolves composition."
    },
    "branding": {
      "source": "userBrandKitOrExplicitUnbranded",
      "preserveLogo": true,
      "neverUseDemoBrand": true
    },
    "typography": {
      "headline": "",
      "supporting": "",
      "cta": "",
      "fontSource": "brandKitOrUserSelection",
      "minimumFontPx": 24,
      "minimumContrast": 4.5,
      "renderAsEditableLayers": true
    },
    "identity": {
      "mode": "sourcePixels",
      "generativeIdentityGuaranteed": false,
      "protectedFeatures": [
        "silhouette",
        "packaging",
        "label",
        "logo",
        "color",
        "modelFace"
      ],
      "allowedTransforms": [
        "translate",
        "uniformScale",
        "crop",
        "rotate"
      ],
      "novelPose": "unsupported",
      "humanReviewRequired": true
    },
    "editableLayers": [
      {
        "id": "background:bg:0",
        "kind": "image",
        "required": true
      },
      {
        "id": "imageSlot:product:1",
        "kind": "image",
        "required": true
      },
      {
        "id": "headline:headline:2",
        "kind": "text",
        "required": true
      },
      {
        "id": "supporting:supporting:3",
        "kind": "text",
        "required": true
      },
      {
        "id": "cta:cta:4",
        "kind": "text",
        "required": true
      },
      {
        "id": "logoSlot:logo:5",
        "kind": "logo",
        "required": true
      }
    ],
    "output": {
      "formatId": "portrait_1080x1350",
      "width": 1080,
      "height": 1350,
      "aspectRatio": "4:5",
      "exports": [
        "png",
        "jpeg"
      ],
      "maxLayers": 80,
      "sceneGraphVersion": "1.0"
    },
    "qualityChecks": [
      {
        "id": "productIdentity",
        "verification": "automatic",
        "severity": "hard",
        "evaluator": "sourceHash",
        "acceptance": "Verify selected source asset/hash provenance only; this does not certify visible identity after integration."
      },
      {
        "id": "packagingGeometry",
        "verification": "aiAssistedUncertain",
        "severity": "hard",
        "evaluator": "geometryComparison",
        "acceptance": "Compare silhouette, proportions and protected regions against source; uncertain results require human review."
      },
      {
        "id": "logoLabelIntegrity",
        "verification": "humanReviewRequired",
        "severity": "hard",
        "evaluator": "visualComparison",
        "acceptance": "Review packaging labels, logo shapes and exact text against original; source hash alone is insufficient."
      },
      {
        "id": "modelConsistency",
        "verification": "humanReviewRequired",
        "severity": "hard",
        "evaluator": "visualComparison",
        "acceptance": "Review supplied model face, clothing and crop when a model is selected; no generative guarantee."
      },
      {
        "id": "brandColor",
        "verification": "automatic",
        "severity": "hard",
        "evaluator": "brandTokens",
        "acceptance": "Compare configured scene color tokens to approved brand snapshot; photographed colors still need visual review."
      },
      {
        "id": "brandTypography",
        "verification": "automatic",
        "severity": "hard",
        "evaluator": "fontResolution",
        "acceptance": "Verify selected font ids, resolved fonts and editable typography tokens; inspect exported typography separately."
      },
      {
        "id": "compositionFocalPoint",
        "verification": "aiAssistedUncertain",
        "severity": "review",
        "evaluator": "visualComparison",
        "acceptance": "Assess subject hierarchy and focal point against reference; human review for aesthetic acceptance."
      },
      {
        "id": "safeAreas",
        "verification": "automatic",
        "severity": "hard",
        "evaluator": "layoutBounds",
        "acceptance": "Check text/logo bounds within output-safe regions and reject clipping."
      },
      {
        "id": "textLegibility",
        "verification": "aiAssistedUncertain",
        "severity": "hard",
        "evaluator": "contrastAndGlyphs",
        "acceptance": "Measure font size/contrast/glyph coverage and review raster text against complex backgrounds; no preflight pass."
      }
    ],
    "providerRequirements": [
      {
        "capability": "generateImage",
        "reason": "Generate scene background only; preserve supplied subject pixels."
      },
      {
        "capability": "referenceGuidedImage",
        "reason": "Use approved reference for artistic scene guidance, not sample product identity."
      },
      {
        "capability": "segmentForeground",
        "reason": "Create validated alpha masks using existing segmentation infrastructure."
      },
      {
        "capability": "sourcePixelComposite",
        "reason": "Integrate exact supplied foreground with editable text/logo layers."
      }
    ]
  },
  {
    "schemaVersion": "1.0.0",
    "blueprintId": "template:model-editorial",
    "revision": 1,
    "entryPoint": {
      "kind": "template",
      "id": "model-editorial",
      "version": "1.0.0"
    },
    "catalog": {
      "templateId": "model-editorial",
      "templateVersion": "1.0.0",
      "catalogVersion": "1.0.0"
    },
    "creative": {
      "objective": "product_promotion",
      "audience": "User must provide target audience",
      "productOrService": "User must select product or service",
      "coreMessage": "User must provide creative message"
    },
    "references": [
      {
        "id": "w0a-model-editorial",
        "availability": "w7Only",
        "approval": "approvedVisualBaseline",
        "locator": ".tmp/consolidated-release/w0a-visual/assets/w0a-model-editorial.jpg",
        "sha256": "38ebb6c013d46f3b21f5a0332570b4f268b817ccf510204d89d60ed027948175",
        "approvalEvidence": ".tmp/consolidated-release/w0a-visual/W0A-VISUAL-DESIGN-PACKAGE.md",
        "provenance": ".tmp/consolidated-release/w0a-visual/SAMPLE-ASSET-PROVENANCE.md",
        "allowedUses": [
          "internalDesignReview"
        ]
      }
    ],
    "requirements": [
      {
        "slotId": "model",